company_name,ticker,cik,filing_type,filing_date,filing_url,Checked,snippet_text_short,KPI_CURRENT_VALUE,KPI_TREND,KPI_HISTORICAL_COMPARISON,TARGET_OUTLOOK,NPS_GOAL_REACHED,METHODOLOGY_DEFINITION,QUALITATIVE_ONLY,has_numeric_nps,nps_value_fix,nps_competition_industry,nps_value_over,nps_value_below,nps_goal_value,nps_goal_change
"eXp World Holdings, Inc.",EXPI,1495932.0,EX-99.1,2025-05-06,https://sec.gov/Archives/edgar/data/0001495932/000155837025006489/expi-20250506xex99d1.htm,,"2 A reconciliation of adjusted operating cash flow, a non-GAAP measure, to operating cash flow and a discussion of why management believes adjusted operating cash flow is useful is included below. dividend of $0.05 per share of common stock for the first quarter of 2025, expected to be paid on June 4, 2025 to stockholders of record on May 19, 2025. First Quarter 2025 Operational Highlights as Compared to the Same Year-Ago Period: ● eXp ended the first quarter of 2025 with a global agent Net Promoter Score (“aNPS”) of 78, up from 73 in the prior-year period. aNPS is a measure of agent satisfaction and an important key performance indicator given the Company’s intense focus on improving the agent experience. ● Agents and brokers on the eXp Realty platform decreased 5% to 81,904 as of March 31, 2025.",1,1,1,0,0,0,0,1,78.0,,,,,
"eXp World Holdings, Inc.",EXPI,1495932.0,EX-99.1,2025-07-31,https://sec.gov/Archives/edgar/data/0001495932/000155837025009882/expi-20250731xex99d1.htm,,"● The Company paid a cash dividend for the second quarter of 2025 of $0.05 per share of common stock on June 4, 2025. On July 24, 2025, the Company’s Board of Directors declared a cash dividend of $0.05 per share of common stock for the third quarter of 2025, expected to be paid on August 29, 2025 to stockholders of record on August 15, 2025. Second Quarter 2025 Operational Highlights as Compared to the Same Year-Ago Period: ● eXp ended the second quarter of 2025 with a global agent Net Promoter Score (“aNPS”) of 77, up from 76 in the prior-year period. aNPS is a measure of agent satisfaction and an important key performance indicator given the Company’s intense focus on improving the agent experience. ● Agents and brokers on the eXp Realty platform decreased (5)% to 82,704 as of June 30, 2025.",1,1,1,0,0,0,0,1,77.0,,,,,
Itau Unibanco Holding S.A.,ITUB,1132597.0,EX-99.1,2022-07-21,https://sec.gov/Archives/edgar/data/0001132597/000119312522198518/d386216dex991.htm,,"Omnichannel refers to an increased level of integration among our channels allowing us to offer better services and products to our clients. Through Phygital and Omnichannel, we are able to implement O2O (Online to Offline) capabilities, a two-way flow between the digital and the physical worlds, not only generating leads and sales, but also increasing consumer satisfaction through frictionless flows. These improvements have already been recognized by clients, as shown in our satisfaction ratings (i.e., Net Promoter Score). Our Mobile App achieved an NPS of 71 points on December 31, 2021. Our digital channels represented 27.8% and 24.6% of our revenue income for the year ended December 31, 2021 and December 31, 2020, respectively.",1,0,0,0,0,0,0,1,71.0,,,,,
"FIRST BUSINESS FINANCIAL SERVICES, INC.",FBIZ,1521951.0,EX-99.1,2024-04-26,https://sec.gov/Archives/edgar/data/0001521951/000152195124000030/fbiz1q24investorpresenta.htm,,8% 76.07% 75.99% ≥ 75% Fee income ratio(1) 25.10% 25.90% 24.92% 23.02% 21.76% 25.00% Client satisfaction 93% 96% 93% 95% 93% ≥ 90% Employee engagement 82% 91% 87% 87% 90% ≥ 80% 1. Decrease throughout the plan year mainly due to net interest margin and loan growth greatly exceeding plan targets leading to exceptional net interest income growth. FirstBusiness.Bank 2024-2028 Strategies FirstBusiness.Bank Strategic 5 Year Plan Overview 5 Year Goals Strategies • ROATCE • TBV Growth • Top Line Revenue Growth • Efficiency Ratio • Core Deposits to Total Funding • Employee Engagement & Participation • Net Promoter Score Culture • Protect and strengthen our unique culture with a growing and geographically dispersed team. Future-Ready Talent • Thrive in the workplace of the future by continuously investing in our team to elevate their impact and contribution Core Deposit Growth • Drive a company-wide commitment to grow our core deposits to meet funding needs by adding new relationships and capitalizing on innovative sources and new technologies. Operational Excellence • Achieve operational excellence by fostering a culture of continuous process improvement and utilization of innovative technology to enhance pr,0,0,0,0,0,0,0,0,,,,,,
"FIRST BUSINESS FINANCIAL SERVICES, INC.",,,,,https://sec.gov/Archives/edgar/data/0001521951/000095017024117034/fbiz-ex99_2.htm,,"5 IN TOTAL ASSETS First Business Bank NASDAQ: FBIZ — $368 million Market Cap1 Five Year Strategic Plan 2024-2028 Strategies OBJECTIVE First Business Bank's unique model and culture will foster innovative and engaged team members who develop deep client relationships and deliver exceptional results for all stakeholders. 2024-2028 Goals & Progress Plan aims to deliver above average total shareholder return compared to peer median Represents data from the 2023 employee engagement survey. Net promoter score assesses likelihood to recommend on an 11-point scale, where detractors (scores 0-6) are subtracted from promoters (scores 9-10), while passives (scores 7-8) are not considered. See appendix for additional information on the source of the net promoter score. Represents data from the 2023 survey.",0,0,0,0,0,0,0,0,,,,,,
Jackson Financial Inc.,"JXN, JXN-PA",1822993.0,EX-99.1,2021-08-17,https://sec.gov/Archives/edgar/data/0001822993/000119312521248334/d171132dex991.htm,,ransparent pricing and best serve customer needs Investment freedom without forced allocations or managed volatility funds Managed volatility fund performance has lagged Jacksons traditional fund options Healthy back book and conservative pricing No buyout offers to induce lapses or increased benefit fees on in-force block Industry leading and award-winning customer service since 2004 (3) Consistently providing support to advisors and policyholders Support of large and productive wholesaling force Jackson ranked #2 in terms of quality of wholesalers (only insurance carrier in top 5) (4) High Net Promoter Highest Advisor Score vs. Industry (2) Consideration Score +29 variable annuity Advisors more likely to NPS vs. industry consider selling one of average NPS of -17 our products High Awareness & High Net Promoter Favorable Impression Score among Advisors 1 of only 3 annuity Ranked #1 and #2 for providers with both advisors distributing designations among variable and advisors fixed annuities 1.,0,0,0,0,0,0,0,1,,-17.0,,,,
Fresenius Medical Care AG,"FMS, FMCQF",1333141.0,EX-99.1,2024-02-20,https://sec.gov/Archives/edgar/data/0001333141/000110465924025085/tm2333637d3_ex99-1.htm,,"Consequently, the dividend proposal for fiscal year 2023 of EUR 1.19 per share corresponds to an increase by 6% compared to prior year’s dividend. Sustainability: Fresenius Medical Care continued to make progress towards its Sustainability goals. Underscoring the Company’s focus on high quality care, the patients’ overall satisfaction with our services measured by the Net Promoter Score of 72 was at an even higher level than in previous years. With its recent submission of the commitment letter to the Science Based Targets Initiative (SBTi), the Company underlines its goal to achieve climate neutrality in its operations by 2040 in line with the Paris Agreement. Page 3 /11 Revenue development driven by solid organic growth In the fourth quarter 2023 , revenue remained flat with EUR 4,988 million (+7% at constant currency, +3% organic).",1,0,0,0,0,0,0,1,72.0,,,,,
JETBLUE AIRWAYS CORP,JBLU,1158463.0,EX-99.3,2025-04-29,https://sec.gov/Archives/edgar/data/0001158463/000115846325000064/a1q25earningspresentatio.htm,,"n initial (1) guidance ranges • Capacity of (4.3%) at low end of range, resulting from self-help actions to reduce trough capacity in March and better align supply with demand • RASM of 1.3% reflecting softer off-peak revenue trends observed in initial guidance and supported by capacity action • CASM ex-Fuel (2) of 8.3% beat initial midpoint, driven by cost savings from operational execution (sixth consecutive quarterly beat) Continued focus on JetForward execution across four priority moves • Operational investments are working – observed a double-digit YoY improvement in Net Promoter Score (NPS) alongside improved on-time performance (3) • Increase in NPS marked fourth consecutive quarter of YoY improvement • A14 was four points better YoY, despite significant weather events • Premium, loyalty and transatlantic segments exhibiting healthy YoY growth 1Q25 (1) Initial guidance as of January 28, 2025. Provided revised guidance for ASMs, fuel price and capital expenditures on March 11, 2025. (2) See Appendix A for further details on Non-GAAP measures.",0,1,0,0,0,0,0,0,,,,,,
JETBLUE AIRWAYS CORP,JBLU,1158463.0,EX-99.1,2025-04-29,https://sec.gov/Archives/edgar/data/0001158463/000115846325000064/ex991-earningsreleaseq12025.htm,,"es, and routes. ""We've already taken a number of steps to build a more resilient financial foundation, and we continue to evaluate all avenues to improve our financial results,"" said Ursula Hurley, JetBlue's chief financial officer. ""We remain confident JetForward will drive enduring structural changes on our path to sustained profitability, and we saw encouraging progress in the first quarter."" Encouraging JetForward Progress in the First Quarter • Reliable & Caring Service ◦ Reliability investments drove a four point year-over-year improvement in A14 as well as a double-digit improvement in Net Promoter Score, marking consecutive quarterly gains for both metrics. ◦ Reliability initiatives from JetForward drove improved operational performance alongside cost savings worth ~0.75pts of CASM ex-fuel (1) in 1Q. • Best East Coast Leisure Network ◦ Efforts to build depth where customers know and love the JetBlue brand are showing strong early progress, and new BlueCities in the northeast are demonstrating margin strength relative to the system.",0,1,1,0,0,0,0,0,,,,,,
JETBLUE AIRWAYS CORP,JBLU,1158463.0,EX-99.1,2025-07-29,https://sec.gov/Archives/edgar/data/0001158463/000115846325000087/ex991-earningsreleaseq22025.htm,,"the total program range and now anticipate $850 to $950 million in EBIT benefit by the end of 2027, up from $800 to $900 million previously."" JetForward Continues to Deliver Results JetBlue delivered $90 million incremental EBIT during the first half of 2025 as part of its JetForward strategy, bringing cumulative gains since inception to $180 million. Performance across all four priority moves continues to drive results: • Reliable & Caring Service : $15 million to-date ◦ For the first half of 2025, on-time performance and completion factor were up 3 points and 0.5 points, respectively, while Net Promoter Score was up double digits – building on improvements from 2024. • Best East Coast Leisure Network : $15 million to-date ◦ Efforts to optimize Transatlantic & Mint ® flying were especially productive, with significant margin improvement year-over-year. ◦ New routes out of secondary cities in the Northeast have performed well and, early into their launch, have some of the highest TrueBlue ® attachment rates per flight.",0,1,0,0,0,0,0,0,,,,,,
JETBLUE AIRWAYS CORP,JBLU,1158463.0,EX-99.1,2025-09-11,https://sec.gov/Archives/edgar/data/0001158463/000115846325000097/lagunafiresidepresenatio.htm,,"nly as of the date of this Presentation. Other than as required by law, we undertake no obligation to update or revise forward-looking statements, whether as a result of new information, future events, or otherwise. 2 3 Successfully delivered $180M of incremental EBIT (1) benefit from JetForward through 1H25 and on-track to achieve $290M by year-end Product Reliability Financial Future Four Priority Moves ~$175M ~$450M ~$100M 2027 Targets Network ~$175M ~$850-950M ✓ Initiated multi-year investment to improve on-time performance: ✓ Recognized by WSJ as the most improved in their ‘24 rankings ✓ Net Promoter Score was up double digits YoY in 1H 2025 ✓ Re-deployed 20%+ of our network since the beginning of 2024 including: ✓ Reinvested in Northeast, Florida, and Puerto Rico franchises ✓ Re-deployed to high performing leisure & VFR ✓ Right-sized LaGuardia and LAX ✓ Introduced preferred seating and EvenMore® ✓ Enhanced Blue Basic with free carry-on bag ✓ Added new loyalty partners ✓ Launched Premium Credit Card ✓ Commenced cost transformation program – realizing $25M in savings in 1H25 from initiatives including but not limited to: ✓ Tools to better manage crew disruptions & fuel consumption ✓ AI and data",0,1,1,0,0,0,0,0,,,,,,
JETBLUE AIRWAYS CORP,JBLU,1158463.0,EX-99.1,2025-10-28,https://sec.gov/Archives/edgar/data/0001158463/000115846325000107/ex991-earningsreleaseq32025.htm,,"Progress in the second half is tracking in-line with expectations toward its cumulative $290 million target, with plans to share full-year results in January 2026. • Reliable & Caring Service ◦ Third quarter 2025 on-time performance was up two points, with completion factor in-line to last year. ◦ Net Promoter Score was up low-single digits for the quarter and remained up double digits for the year, building on improvements from 2024. • Best East Coast Leisure Network ◦ Reaffirmed position as Fort Lauderdale's largest airline with new routes, additional frequencies and more job opportunities for the region. ◦ Announced new service from New York's John F.",0,1,0,0,0,0,0,0,,,,,,
"Kyndryl Holdings, Inc.",KD,1867072.0,EX-10.1,2022-02-25,https://sec.gov/Archives/edgar/data/0001867072/000110465922027351/tm227537d1_ex10-1.htm,,"es, earnings before taxes and net earnings, and other metrics); earnings per share; sustainability; achievement of ESG goals; expenses; gross margin; growth in stockholder value; internal rate of return; market share; net income; net profit; net sales; operating cash flow; operating expenses; operating income; operating margin; overhead or other expense reduction; productivity; profit; return on assets; return on capital; return on equity; return on investment; return on sales; stock price; total stockholder return; revenue; contract awards; customer satisfaction, renewals or retention rates; net promoter score; business divestitures or acquisitions; increases in specified indices; the attainment of growth rates; diversity and inclusion; employee engagement; and any other measures of performance. The goals and performance factors may be established on any basis the Committee determines relevant, in its sole discretion, and may be established on an individual, divisional, business unit or enterprise basis. The performance goals may differ from Participant to Participant and from award to award.",0,0,0,0,0,0,1,0,,,,,,
"Freshpet, Inc.",FRPT,1611647.0,10-K/A,2024-04-30,https://sec.gov/Archives/edgar/data/0001611647/000143774924013821/frpt20231231_10ka.htm,,"Our workforce consists of approximately 730 hourly production employees, 240 salaried and managerial employees in manufacturing and 111 salaried and managerial employees in other functions, such as Marketing, Finance, Sales, Consumer Care, and other support and distribution roles. Employee Engagement In 2022 Freshpet conducted a comprehensive Engagement survey and achieved a total engagement index of 78% with a participation rate of 66%. In 2023 we completed a pulse survey, and the Net Promoter score was 8.2, a 0.2 increase from our previous Net promoter score. We believe that the positive score continues to demonstrate our employees’ positive perception about the future of our organization and strong belief in our vision. At Freshpet, our programs are designed to reward and support employees through competitive pay, creative incentive programs and generous benefits.",1,1,1,0,0,0,0,1,8.2,,,,,
"Frontier Communications Parent, Inc.",FYBR,20520.0,EX-99.1,2022-02-23,https://sec.gov/Archives/edgar/data/0000020520/000114036122006328/brhc10034156_ex99-1.htm,x,"“2021 was a year of remarkable transformation reflected in our strong fourth-quarter and full-year results”, said Nick Jeffery, President and Chief Executive Officer of Frontier. “The team rallied around our purpose of Building Gigabit America™ in March and spent the next nine months breaking our own records for building and selling fiber. As we added new fiber customers, we also made service improvements that earned us a positive fiber Net Promoter Score for the first time in the company’s history. In the fourth quarter, we gained momentum and hit an inflection point, reaching positive total broadband net adds for the first time in more than five years. “The future is fiber, and we are well on our way to becoming a fiber-first company.",0,1,0,0,0,0,0,0,,,,,,
Lavoro Ltd,"LVRO, LVROW",1945711.0,EX-99.3,2022-09-15,https://sec.gov/Archives/edgar/data/0001945711/000110465922100229/tm2224867d2_ex99-3.htm,,"We really focus on having a close relationship between our commercial team and farmers. The vast majority of our sales reps are agronomists with extensive experience in their regions. The quality of our sales force is reflected on Lavoro’s excellent net promoter score. Here it is also important to highlight that since we acquire many companies, keeping the commercial team engaged is a golden rule in Lavoro. Slide 31 - Ruy Cunha The second part of our route-to-market strategy is the digital platform.",0,0,0,0,0,0,1,0,,,,,,
LEGALZOOM COM INC,LZ,1286139.0,CORRESP,2021-06-04,https://sec.gov/Archives/edgar/data/0001286139/000119312521183264/filename1.htm,,"Response: In response to the Staffs comment, the Company has revised the disclosure on pages 2-3, 69 and 113 of the Registration Statement. 2. We note that in response to prior comment 1 you disclose the net promoter score (NPS) for traditional online attorneys. Please also disclose the NPS for your business formation products, small businesses and attorney network. Response: In response to the Staffs comment, the Company has revised the disclosure on pages 5-6 and 117-118 of the Registration Statement.",0,0,0,0,0,0,1,0,,,,,,
LIQUIDITY SERVICES INC,LQDT,1235468.0,EX-99.1,2022-12-09,https://sec.gov/Archives/edgar/data/0001235468/000123546822000144/earningscalltranscript_q4f.htm,,"For example, since fiscal 2020, our GMV per seller and a number of assets sold per seller on GovDeals have grown 44% and 19%, respectively. We're also committed to the relentless improvement of our platform and we'll be launching the next generation of our GovDeals marketplace in 2023. The beta version of our new GovDeals marketplace was shared with select bidders in Q4 and was extremely well received, resulting in a 2x increase in our customer net promoter score. This bodes well for the future and we expect our modernized GovDeals platform and introduction of more data driven features will increase our recovery rates and lift GovDeals' GMV materially over time. As client vehicle replenishment cycles normalize, federal infrastructure spending takes hold and we continue our pace of account acquisition, we see the opportunity to significantly grow the size of our GovDeals business over the next three to five years.",0,1,0,0,0,0,0,0,,,,,,
"LiveOne, Inc.",LVO,1491419.0,EX-99.1,2025-01-31,https://sec.gov/Archives/edgar/data/0001491419/000121390025008571/ea022941301ex99-1_liveone.htm,,"mbership Plans from $0 to $9.99 Per Month Growing Library of Franchises Highly - rated Originals Podcasts Partnerships ContentOne studio to develop and distribute new originals and tentpole events across the platform 9 streaming service that first l LiveOne’s Slacker Radio is a music aunched in 2007, which offers a free ad - supported experience as well as multiple subscription options with millions of songs and access to expertly crafted stations, podcasts from PodcastOne, on - demand video programming, and livestream concerts and pay - per - view (PPV) events • Excellent Net Promoter Score (NPS) of 55, and ranked as the “Editor’s Choice” multiple times by PC Magazine, including 2025 “Best for Curated Channels” . • In January 2025, total paid and monthly active ad - supported users exceeded 860k. • Nearly all Tesla EVs sold in the U.S.",1,0,0,0,0,0,0,1,55.0,,,,,
"LiveOne, Inc.",LVO,1491419.0,EX-99.1,2025-02-25,https://sec.gov/Archives/edgar/data/0001491419/000121390025016813/ea023187101ex99-1_liveone.htm,,"mbership Plans from $0 to $9.99 Per Month Growing Library of Franchises 9 Highly - rated Originals Podcasts Partnerships ContentOne studio to develop and distribute new originals and tentpole events across the platform LiveOne’s Slacker Radio is a music streaming service that first launched in 2007, which offers a free ad - supported experience as well as multiple subscription options with millions of songs and access to expertly crafted stations, podcasts from PodcastOne, on - de mand video programming, and livestream concerts and pay - per - view (PPV) events • Excellent Net Promoter Score (NPS) of 55, and ranked as the “Editor’s Choice” multiple times by PC Magazine, including 2025 “Best for Curated Channels” . • In January 2025, total paid and monthly active ad - supported users exceeded 860k. • Nearly all Tesla EVs sold in the U.S.",1,0,0,0,0,0,0,1,55.0,,,,,
"LiveOne, Inc.",LVO,1491419.0,EX-99.1,2025-11-26,https://sec.gov/Archives/edgar/data/0001491419/000121390025115100/ea026737301ex99-1_liveone.htm,,"mbership Plans from $0 to $9.99 Per Month Growing Library of Franchises Highly - rated Originals Podcasts Partnerships ContentOne studio to develop and distribute new originals and tentpole events across the platform 9 streaming service that first l LiveOne’s Slacker Radio is a music aunched in 2007, which offers a free ad - supported experience as well as multiple subscription options with millions of songs and access to expertly crafted stations, podcasts from PodcastOne, on - demand video programming, and livestream concerts and pay - per - view (PPV) events • Excellent Net Promoter Score (NPS) of 55, and ranked as the “Editor’s Choice” multiple times by PC Magazine, including 2025 “Best for Curated Channels” . • In July 2025, total paid and monthly active ad - supported users exceeded 2.3 million. • Nearly all Tesla EVs sold in the U.S.",1,0,0,0,0,0,0,1,55.0,,,,,
LuxExperience B.V.,"LUXE, MYTE",1831907.0,EX-99.2,2025-05-14,https://sec.gov/Archives/edgar/data/0001831907/000110465925048064/tm2513918d1_ex99-2.htm,,"The luxury multi-brand digital platform reported solid growth and continued Adj. EBITDA profitability in a tough market environment. The Company’s third quarter highlights include an outstanding Average Order Value, continued gross margin expansion, decrease in return rates, record-high NPS and strong profitability. Michael Kliger, Chief Executive Officer of LuxExperience , said, ”The results of the third quarter demonstrate once again the strength of the Mytheresa business model. Solid GMV growth, higher top customer spend, continued product margin expansion and strong profitability show the health and resilience of the Mytheresa business despite macro headwinds.” Kliger continued, “The strong results of the Mytheresa business model underline the fantastic prospects for the recently acquired YOOX NET-A-PORTER business.",0,1,0,0,0,0,0,0,,,,,,
LuxExperience B.V.,LUXE,1831907.0,EX-99.2,2026-02-11,https://sec.gov/Archives/edgar/data/0001831907/000110465926013072/luxe-20251231xex99d2.htm,,"Q2 FY25 ● Industry-leading Net Promoter Score of 83.7 in Q2 FY26, up 40bps vs. the prior year period LUXURY | NAP & MRP KEY BUSINESS HIGHLIGHTS (1) ● NET-A-PORTER and MR PORTER driving customer engagement through uniquely engaging editorial content ● NET-A-PORTER featured Le Club Rabanne via an exclusive capsule and PORTER Magazine cover; headlined the December issue of PORTER Magazine with a Serena Williams exclusive; and relaunched same day delivery in London and New York, supported by a multi-channel Holiday and Gifting Campaign ● MR PORTER featured musician and writer Josh Homme in the MR PORTER Journal; launched new video franchises",1,0,0,0,0,0,0,1,83.7,,,,,
MANULIFE FINANCIAL CORP,"MFC, MNLCF, MNQFF, MNUFF",1086888.0,EX-99.1,2021-06-29,https://sec.gov/Archives/edgar/data/0001086888/000119312521202989/d135076dex991.htm,,"our strategy, with a greater focus on accelerating the growth of our highest potential businesses and are committing to meaningful metrics to measure our progress through to 2025. Manulife remains committed to our medium-term targets and has a clear path to delivering 10 to 12 per cent annual Core EPS growth, said Manulife Chief Financial Officer Phil Witherington. Discussions at Manulife Investor Day 2021 will focus on the next phase of our journey, with plans to:  Generate 75 percent of total company core earnings from highest potential businesses by 2025.  Reach a Net Promoter Score (NPS) of +37 and Straight Through Processing (STP) of 88 per cent by 2025.  Continue to focus on Portfolio Optimization and reduce the combined contribution from LTC and VA to less than 15 per cent of total company core earnings by 2025. The earnings profile of the Company has shifted as a function of growth in our Asia and Global WAM businesses outpacing other segments.",1,0,0,1,0,0,0,1,37.0,,,,,
