company_name,ticker,cik,filing_type,filing_date,filing_url,Checked,snippet_text_short,KPI_CURRENT_VALUE,KPI_TREND,KPI_HISTORICAL_COMPARISON,TARGET_OUTLOOK,NPS_GOAL_REACHED,METHODOLOGY_DEFINITION,QUALITATIVE_ONLY,has_numeric_nps,nps_value_fix,nps_competition_industry,nps_value_over,nps_value_below,nps_goal_value,nps_goal_change
Atlantic Union Bankshares Corp,"AUB, AUB-PA",883948.0,FWP,2021-12-01,https://sec.gov/Archives/edgar/data/0000883948/000110465921145268/tm2133979d2_fwp.htm,x,"Based on over 12,000 interviews with small businesses across the country 2020 Greenwich Excellence Award Winner, South Region (Overall Satisfaction) 95 74 70 69 Atlantic Union Bank Big Bank #1 Big Bank #2 Big Bank #3 J.D. Power 2021 U.S. Retail Banking Satisfaction Study (Overall Satisfaction, Mid - Atlantic) AUB Overall ( Verint /Foresee) 2019 2020 YOY Overall Satisfaction 86 87 +1 Recommend AUB 85 87 +2 Increase Business 84 86 +2 Make Banking Easy 87% 88% +1% Net Promoter Score (NPS) 57 61 +4 AUB sees year over year improvements in Net Promoter Score, making banking easier and other key customer metrics. Recently Recognized By: 854 832 832 821 817 814 808 807 806 804 Atlantic Union Bank Region Average Proven Track Record of Superior Customer Satisfaction 15 Caring Working together toward common goals, acting with kindness, respect and a genuine concern for others. Courageous Speaking openly, honestly and accepting our challenges and mistakes as opportunities to learn and grow.",1,1,1,0,0,0,0,1,61.0,,,,,
PEAPACK GLADSTONE FINANCIAL CORP,PGC,1050743.0,EX-99.1,2025-04-30,https://sec.gov/Archives/edgar/data/0001050743/000095017025060851/pgc-ex99_1.htm,x,2024 new business inflows totaled $710MM. See page 17 for notes and important information. 30% Core Relationship Deposit1 Growth $1.85 Earnings Per Share 16% Noninterest-bearing Deposit Growth 14% Net Interest Income Growth2 (11% Q4 Increase) 17% Balance Sheet Liquidity3 Financial Results An Emerging Regional Player Green – Deposit Clients Blue – Commercial Loan/Lease Clients Gold – Wealth Management Clients Net Promoter Score Results 81 57 Peapack Private NY C&I (2024) Peapack Private Bank (2024) NPS Scores Best in Class 70+ Excellent 50+ Good 30+ 75 USAA (2023) 73 Amazon (2023) 72 Apple (2022) 31 U.S. Commercial Banks (2024) An Enviable Wealth Management Business See page 17 for notes and important information. Metro NY ExpansionResults through Year-End Hiring across critical support areas to support our growth.,1,0,0,0,0,0,0,1,81.0,31.0,,,,
Aldel Financial Inc.,"HGTY, HGTPW",1840776.0,DEFA14A,2021-11-22,https://sec.gov/Archives/edgar/data/0001840776/000110465921142109/tm2133497d1_defa14a.htm,x,"We have a freemium to paid aspect of that. We insure about 2 million vehicles across our jurisdictions. Net promoter score, which is something we're really proud of because it directly connects to the culture of a company we believe and its brand is an 84 net promoter score, which in insurance is extraordinary, but in almost any business is something to be proud of, we believe. We have this really strong lifetime value to customer acquisition cost. We're about 600 plus million in change this year and from a revenue standpoint, 90% retention, which is really strong and a 41% loss ratio, which if you know anything about auto insurance, that's extraordinary.",1,0,0,0,0,0,0,1,84.0,,,,,
"Butterfly Network, Inc.","BFLY, BFLY-WT",1804176.0,10-K,2021-03-29,https://sec.gov/Archives/edgar/data/0001804176/000110465921043278/tm214074d1_10k.htm,x,"In the United States, we sell to or have agreements in place with most of the top 100 U.S. healthcare systems. Moreover, positive feedback about Butterfly iQ+ among practitioners has historically been a significant driver of sales, as healthcare practitioners share their appreciation for Butterfly iQ within their medical communities, which has yielded a strong net promoter score. A net promoter score is a metric used as a measure of customer satisfaction and word of mouth referrals. A strong net promoter score has been shown to correlate with revenue growth relative to competitors.",0,0,0,0,0,0,1,0,,,,,,
NEOGENOMICS INC,NEO,1077183.0,EX-99.1,2021-01-05,https://sec.gov/Archives/edgar/data/0001077183/000107718321000019/neoinvestorpowerpointfin.htm,x,"Solid Tumor  Discovery Profile: 336 biomarkers  Precision Profile: 83 biomarkers  Universal NGS Fusion Panel: 252 genes Hematologic Disease  NeoTYPE® Myeloid Disorders: 63 genes InVisionFirst® Lung  37 genes  Reflex ordering with NeoTYPE® Lung Tissue NeoLAB® liquid biopsy suite  1 Solid Tumor Test  4 Hematologic Tests 16 Right Test Right Patient Right Time Flexible AppropriateTechnology Agnostic A Differentiated Approach To NGS Testing Multiple Modalities And Appropriate Biomarkers Leads To Great Care At A Value We Are Focused on The Customer NOTES: 1,055 respondents 17 Best in Class Net Promoter Score Q4 2020 Clinical Client Survey How likely is it that you would recommend this company to a friend or colleague? 0 1 2 3 4 5 6 7 8 9 10 Not at all likely Neutral Extremely likely Detractor Passive Promoter 7% 20% 73% 0 50 100100 50 +66 NPS Satisfaction Model Employee Engagement Employee Retention Customer Satisfaction Client Retention >95% Shareholder Satisfaction Achieve Results >Plan % Promoters % Detractors = NPS (Net Promoter Score) Clinical Reference Labs with Oncology Divisions Niche Oncology Players High R&D investment and limited test menus 18 Diversified Focus Leading Share in U.S. Cl",1,0,0,0,0,1,0,1,66.0,,95.0,,,
SPRING VALLEY ACQUISITION CORP.,"SMR, SMR-WT",1822966.0,425,2021-05-17,https://sec.gov/Archives/edgar/data/0001822966/000110465921067997/tm2110955d27_425.htm,x,"y Production closer to the consumer New standard for food safety Consistency Year-round growing Democratized production Zero pesticides Strong unit economics Up to 95% less water The short leafy greens growth cycle allows for rapid experimentation and innovation, providing AeroFarms with data insights to enhance its technology platform and expand to other product areas 24 AeroFarms Wins at Retail with Great Tasting Leafy Green Products In 2020 AeroFarms products performed on average 50% better than the average velocity per SKU of the indoor farming industry¹ AeroFarms received a best-in-class Net Promoter Score of 55; 57% higher than the indoor vertical farming segment average2 AeroFarms product is currently in over 200 stores in the Northeast, including Whole Foods Market, where AeroFarms experienced over 500% growth from 2019 to 2020 AeroFarms locally grown produce wins on quality, flavor, taste and texture with products that are priced competitively with organic players and other local farmers Along with baby leafy greens, AeroFarms sells products in high growth segments, such as microgreens AeroFarms retired its Dream Greens brand and introduced a new unified AeroFarms brand in 2021 1 Nielsen W/",1,0,0,0,0,0,0,1,55.0,,,,,
US BANCORP \DE\,"USB, USB-PA, USB-PH, USB-PP, USB-PQ, USB-PR, USB-PS",36104.0,EX-99.2,2021-09-21,https://sec.gov/Archives/edgar/data/0000036104/000110465921117620/tm2128006d1_ex99-2.htm,x,"Disclaimer 3 U.S. BANCORP | A Strategically and Financially Attractive Acquisition Meaningfully enhances scale Increases share in attractive markets Improves returns, accelerates long - term growth Creates significant value through expense synergies Opportunity to deploy broad product set and offer digital capabilities Similar customer - centric cultures and credit underwriting discipline 4 U.S. BANCORP | Leading customer service & net promoter scores $90B $58B Acquiring a Well - Established West Coast Franchise Key Operating Metrics Deposits Loans Source: FDIC deposit market share data as of June 30, 2021 adjusted for in - scope deposits acquired. Note: Assets, loans, deposits, and key metrics as of June 30, 2021. 1 Estimated tangible book value delivered at close.",0,0,0,0,0,0,0,0,,,,,,
SPRING VALLEY ACQUISITION CORP.,"SMR, SMR-WT",1822966.0,DEFA14A,2021-08-13,https://sec.gov/Archives/edgar/data/0001822966/000110465921104978/tm2124462d10_defa14a.htm,x,"Mass market retailers, for us that's again, Walmart, ShopRite, specialty retailers for us, that's Full Fruits or Morton Williams, online retailers for us, that's Fresh Direct or Amazon Fresh, and food service, like Baldor. David Rosenberg : And let's have excellent experiences there so we could go to our future customers and say, two key metrics that you follow are units per store per week, and our units per store per week are about 50% higher than the competitive set. The other key metric is net promoter score, which is one's likelihood to recommend product to their friends. And we share our net promoter score. Most people don't.",0,0,0,0,0,0,1,0,,,,,,
MILLICOM INTERNATIONAL CELLULAR SA,"TIGO, MLCMF",912958.0,6-K,2022-03-17,https://sec.gov/Archives/edgar/data/0000912958/000095010322004719/dp169195_6k.htm,x,"aligned with Millicom’s strategy to expand broadband, to monetize mobile data, drive convergence, accelerate B2B, go digital and provide the best customer service and experience. These measures, and relative weightings (shown below) are designed to reflect Millicom’s strategic goals of encouraging profitable operations, efficient use of capital, overall growth and customer focus: (i) Service Revenue (20%), (ii) Earnings Before Interest, Tax, Depreciation and Amortization (“ EBITDA ”) (20%), (iii) Operating Free Cash Flow after Leases* (“ OFCFal ”) (20%), (iv) Relational Net Promoter Score (“ rNPS” ) (10%), and (v) Personal Performance** (30%). * EBITDA less CAPEX (OCF), less changes in working capital and other non-cash items and taxes paid (OFCF), less lease capital and interest repayments. ** Personal Performance is assessed on achievement of personalized qualitative and quantitative goals aligned to the overall strategy and objectives of the Company.",0,0,0,0,0,0,1,0,,,,,,
MILLICOM INTERNATIONAL CELLULAR SA,"TIGO, MLCMF",912958.0,6-K,2023-04-24,https://sec.gov/Archives/edgar/data/0000912958/000095010323006044/dp192553_6k.htm,x,"gned with Millicom’s strategy to expand broadband, to monetize mobile data, drive convergence, accelerate B2B, go digital and provide the best customer service and experience. These measures, and relative weightings (shown below) are designed to reflect Millicom’s strategic goals of encouraging profitable operations, efficient use of capital, overall growth and customer focus: (i) Service Revenue (20%), (ii) Earnings Before Interest, Tax, Depreciation and Amortization (“ EBITDA ”) (20%), 15 (iii) Operating Free Cash Flow after Leases* (“ OFCFal ”) (20%), (iv) Relational Net Promoter Score (“ rNPS” ) (10%), and (v) Personal Performance** (30%). * EBITDA less CAPEX (OCF), less changes in working capital and other non-cash items and taxes paid (OFCF), less lease capital and interest repayments. ** Personal Performance is assessed on achievement of personalized qualitative and quantitative goals aligned to the overall strategy and objectives of the Company.",0,0,0,0,0,0,1,0,,,,,,
"Compass, Inc.",COMP,1563190.0,DRSLTR,2021-02-12,https://sec.gov/Archives/edgar/data/0001563190/000095012321002017/filename1.htm,x,"2. 4. Please clarify the method by which you calculate your net promoter score and explain how management uses this score to monitor or manage your business. Disclose any underlying assumptions and limitations in how the score is calculated or used. In response to the Staffs comment, the Company has revised its disclosure on pages 1, 49, 61 and 89 of Draft No.",0,0,0,0,0,1,0,0,,,,,,
"Accolade, Inc.",ACCD,1481646.0,DEF 14A,2024-06-21,https://sec.gov/Archives/edgar/data/0001481646/000148164624000029/accd-20240621.htm,x,"Our compensation committee believes these performance goals reflect commonly recognized measures of financial and operating performance within our industry and are key drivers of sustained value creation for our stockholders. The performance goals and weightings, in addition to our actual performance, are set forth in the table below. Revenue, New Bookings (ARR), and Net Promoter Score have target levels of achievement as well as a pay-and-performance curve around target with threshold and maximum levels. Given the importance of achieving our Adjusted EBITDA target, this metric's achievement evaluation was structured as all-or-nothing. [TABLE] Performance Goal: Net Promoter Score (4) | Weighting: 25% | Threshold: 48 | Target: 60 | Maximum: 100 | Actual Performance: 71 [/TABLE].",0,0,0,1,1,0,0,1,,,,,48.0,
SPRING VALLEY ACQUISITION CORP.,"SMR, SMR-WT",1822966.0,CORRESP,2021-06-22,https://sec.gov/Archives/edgar/data/0001822966/000110465921083887/filename1.htm,x,"Response: The Company acknowledges the Staff’s comment and has revised the disclosure on page 172 of the Revised Registration Statement in accordance with the Staff’s comment. 17. Staff’s comment: We note your statement on page 166: “In a recent customer survey, for example, we received a best-in-class Net Promoter Score over 50% higher than the vertical farming segment average.” Please revise page 166 to explain the Net Promoter Score metric, including the basis for the vertical farming segment average Net Promoter Score. Response: The Company acknowledges the Staff’s comment and has revised the disclosure on page 173 of the Revised Registration Statement in accordance with the Staff’s comment. 5 18.",1,0,0,0,0,0,0,1,,,50.0,,,
SPRING VALLEY ACQUISITION CORP.,"SMR, SMR-WT",1822966.0,EX-99.3,2021-03-26,https://sec.gov/Archives/edgar/data/0001822966/000110465921042008/tm2110955d1_ex99-3.htm,x,"020 AeroFarms locally grown produce wins on quality, flavor, taste and texture with products that are priced competitively with organic players and other local farmers Along with baby leafy greens, AeroFarms sells products in high growth segments, such as microgreens AeroFarms sells its products under its Dream Greens brand and will be introducing a unified rebrand in 2021 1 Nielsen W/E 12/5/20 latest 52 weeks (collection of 5 leading grocery retailers in New York Metropolitan Area), combined with Nielsen FY2020 latest 52 weeks (1 leading grocery retailer in the New York Metropolitan Area); 2 Net Promoter Score is a key indicator of customer satisfaction, measured through third-party testing conducted by Qualtrics 25 In 2020 AeroFarms products performed on average 50% better than the average velocity per SKU of the indoor farming industry¹ AeroFarms received a best-in-class Net Promoter Score of 55; 57% higher than the indoor vertical farming segment average2 Top Tastemakers Applaud AeroFarms Products “An exquisite culinary experience“ Edmund LaMacchia VP of Procurement – Perishables, Whole Foods (former) “This is what I love about AeroFarms – that it's technology that's allowing people to farm bett",1,0,0,0,0,1,0,1,55.0,,,,,
VODAFONE GROUP PUBLIC LTD CO,"VOD, VODPF",839923.0,6-K,2021-10-01,https://sec.gov/Archives/edgar/data/0000839923/000110465921121765/tm2129021d1_6k.htm,x,"In addition, a live video Q&A webcast will commence at 2.00pm BST on 29 September 2021, with an on-demand recording available shortly afterwards. Key highlights from the event: 1. Deep & trusted customer relationships ⫶ Following a series of initiatives conducted over the last 3 years, Vodafone has improved its net promoter score to be the #1 or #2 operator in 13 of 16 markets. This has contributed to systematic reductions in mobile contract churn and increasing fixed connectivity customers. The next phase of improving loyalty with consumers will be achieved through our multi-product connectivity strategy, 'Digital First' consumer engagement platforms and complementary digital services, all underpinned by our purpose-led brand.",0,1,0,0,0,0,0,0,,,,,,
AGCO CORP /DE,AGCO,880266.0,EX-99.2,2024-12-19,https://sec.gov/Archives/edgar/data/0000880266/000088026624000066/ex-992.htm,,"s with Increased Focus on Sustainability AGCO is Well-Positioned to Address SECULAR TRENDS and BETTER SERVE FARMERS World Crop Use Will Fuel Precision Ag and Machinery Growth(1) 0.0B 0.5B 1.0B 1.5B 2.0B 2.5B 3.0B 3.5B 4.0B Bi lli on s of M et ric T on s Crop Year World Corn + Soybeans + Wheat Use 7 AG MACHINERY AG TECHNOLOGY Brands & Value Propositions Leaders Drive Fendt Straightforward Dependable Accessible Your Working Machine Industry leader for mixed fleet precision AG through OEM and Retrofit Winning Outcomes Strategy Fundamentals Leader in Precision Ag FarmerCore Operational Efficiency Net Promoter Score Employee Engagement RONA Growth Farmer Focused Solutions To Sustainably Feed Our World 8 OUR TARGETS DEMONSTRATING PROGRESS 1) Compared to 2023 product offering 2) From a 2022 baseline, aligned with 1.5C trajectory, 90% is the 2050 target 3) Water and waste targets will be extended out to 2030 once data quality improved 4) 2025 baseline 5) New recordable incident target being developed with 2030 timeline Sustainability Objectives Innovate For A Triple-win Power The Future Of Ag Advance A Responsible Product Life Cycle Thrive Together Employees, Dealers And Farmers Total recordable incidents b",0,0,0,0,0,0,0,0,,,,,,
Aldel Financial Inc.,"HGTY, HGTPW",1840776.0,DEFA14A,2021-11-17,https://sec.gov/Archives/edgar/data/0001840776/000110465921140343/tm2133200d1_defa14a.htm,,"A passion story. A growth story. 6 A highly differentiated membership - based growth story 1 NPS is defined as “Net Promoter Score”, a leading measure of customer experience and satisfaction with companies and brands Large & underpenetrated market opportunity Tapping underserved passion - led automotive enthusiast market Unique membership ecosystem for car lovers Exceptional brand loyalty; multiple points of monetization Sufficient capital to fund growth priorities Continued double - digit growth and further margin expansion; potential growth beyond base plan Proven & resilient financial profile Track record of revenue & earnings growth 01 Omni channel distribution strategy Established p",0,0,0,0,0,0,0,0,,,,,,
ENCORE CAPITAL GROUP INC,ECPG,1084961.0,DEF 14A,2022-04-29,https://sec.gov/Archives/edgar/data/0001084961/000108496122000045/ecpg-20220429xdef14a.htm,x,"bility against our goals can be found below: 18 Table of Contents ESG Metrics Impact Executive Compensation As part of our commitment to ESG, approximately 40% of the funding of the 2021 annual bonus plan for our executive officers is based on the achievement of certain ESG-related metrics, which are detailed below: [TABLE] ESG Key Pillar: We Support and Value Our People | ESG-Related Compensation Goal: To promote a culture of respect and inclusion and to foster a positive work environment, 15% of the funding of the executive bonus plan is based on metrics related to inclusion and an employee net promoter score. [/TABLE]. 2022 ESG Priorities In 2022, our efforts continue to underscore the importance of ESG at Encore for years to come. Our five key pillars guide our decision making and help communicate to internal and external stakeholders where we hope to make the most impact.",0,0,0,0,0,0,0,0,,,,,,
Aldel Financial Inc.,"HGTY, HGTPW",1840776.0,EX-99.1,2021-08-18,https://sec.gov/Archives/edgar/data/0001840776/000110465921107195/tm2125307d1_ex99-1.htm,x,"ADF) (“Aldel”), a special purpose acquisition company, today announced that they have entered into a definitive business combination agreement. Upon the closing of the transaction, Aldel will be renamed Hagerty, Inc., and become publicly traded, with its common stock expected to be listed on the New York Stock Exchange under the ticker HGTY. Passion Fueled Growth Targeting Expansive Automotive Enthusiast Market Hagerty is a leading specialty insurance provider for classic and enthusiast vehicles -- with more than 2 million vehicles insured globally, an industry-leading 84 Net Promoter Score (NPS) and partnerships with nine of the top 10 U.S. automotive insurers. At Hagerty, everything begins and ends with the love of the automobile – a passion shared with its more than 1.8 million members that fuels the company’s distinguished membership model and positions Hagerty to optimize growth in the estimated 43+ million vehicle automotive enthusiast market.",0,0,0,0,0,0,0,0,,,,,,
Aldel Financial Inc.,"HGTY, HGTPW",1840776.0,425,2021-08-19,https://sec.gov/Archives/edgar/data/0001840776/000110465921107472/tm2125463d1_425.htm,x,"Although Hagerty is much larger than any of its direct competitors, it has a relatively small share of a large market – both in terms of vehicles insured and available premium to be written of approximately 4%. The Hagerty family founded the business three decades ago and will maintain its strong leadership position and continue to grow the Company. Their unique membership model has led to a loyal and sticky customer base, as measured by a high Net Promoter Score of 84 versus the auto insurance industry average of about 39; their customer retention rate of 90% and low average loss ratios of 41% over the past three years. They have multiple distribution channels, which gives them a competitive advantage in customer acquisition. And a real orientation toward using data in a smart way.",1,0,0,0,0,0,0,1,84.0,,,,,
XP Inc.,XP,1787425.0,EX-99.1,2023-12-08,https://sec.gov/Archives/edgar/data/0001787425/000095010323017317/dp203814_ex9901.htm,x,"cquisition Channel Diversification Specialized Advisors Superior Functionality Smarter Curated Advice Better Software & Apps Highest Quality Support 2009 2023 Evolving Beyond the Market to Differentiate with Higher Quality Services End - to - End Genius XP – Proprietary software to personalize asset allocation & risk management Portfolio Optimization Financial Planning Training & Incentives XP’s 3 rd Wave Empowering XP Advisors to Provide Enhanced Quality & Experience in the Market Match client’s personal objectives and investment portfolio Evaluate and training on Service + individual client NPS results XP Awarded Best Financial Advisory Firm 5 Years in a Row¹ Genius XP 10 Note: 1 – Annual survey published by DataFolha . 11 3Q’19 @IPO 3Q’23 Current 3.1 x Client Assets 6.7 % 11.3 % + 460 bps Market Share 1 2.9 x Active Clients XP Invested to Scale & Expand Significantly Since the IPO R$ 350 Billion R$ 1,080 Billion 1.5 Million 4.4 Million Note: 1 – Investments for Individuals Market Share, according to Anbima (self - regulated capital markets entity in Brazil) data. 12 XP is Leading the Evolution of the Advisory Profession in Brazil Financial Consultants Wealth Managers Retail Financi",0,0,0,0,0,0,0,0,,,,,,
PERUSAHAAN PERSEROAN PERSERO PT TELEKOMUNIKASI INDONESIA TBK,TLK,1001807.0,6-K,2023-05-02,https://sec.gov/Archives/edgar/data/0001001807/000100180723000021/tmb-20230502x6k.htm,x,"Impact Customers are Telkom's priority, and we always want to provide them with the best experience. Excellent service can improve customer experience and growth which will then have a positive impact on financial and operational performance. Commitment and Target ● TelkomGroup's Net Promoter Score (NPS) for 2022 is targeted at a minimum of 51, with a target in 1 st Semester was 50 and a target for 2 nd Semester is 51. The target score grows by 2 points compared to the 2 nd Semester achievement in the previous year of 49. NPS calculation refers to the standard calculation formula NPS globally, and measurement carried out by third-party surveyor partners to maintain independence and objectivity.",0,0,0,1,0,1,0,1,,,,,51.0,2.0
AZUL SA,AZUL,1432364.0,6-K,2025-05-14,https://sec.gov/Archives/edgar/data/0001432364/000129281425002077/azulpr1q25_6k.htm,,"§ Unit revenue (RASK) remained strong at R$42.14 cents in 1Q25, even with capacity growing 15.6% year-over-year. Another contributing factor to our healthy revenues and margins is the growth in our business units, which in 1Q25 accounted for 23% of RASK and 35% of EBITDA, at more than R$480 million. § Azul made significant improvement in the overall travel experience, which translated into a Net Promoter Score (NPS) recovery of more than 30 points in March 2025 compared to December 2024. § 1Q25 EBITDA reached R$1,385.8, down 2.1% year-over-year, mainly impacted by the depreciation of the Brazilian real against the US dollar, higher fuel prices, and inflation. EBITDA margin in 1Q25 was 25.7%, 4.6 percentage points lower than in 1Q24.",1,1,1,0,0,0,0,1,,,30.0,,,
"CS Disco, Inc.",LAW,1625641.0,DRSLTR,2021-06-11,https://sec.gov/Archives/edgar/data/0001625641/000095012321007810/filename1.htm,,"The Company has revised the disclosure on page 65 of the Draft Registration Statement to provide additional detail on its results of operations in 2020, but the Company is unable to isolate and quantify the direct impact from COVID-19. Cooley LLP 500 Boylston Street, 14 th Floor Boston, MA 02116-3736 t: (617) 937-2300 f: (617) 937-2400 cooley.com United States Securities and Exchange Commission June 11, 2021 Page Three Business, page 82 4. Please clarify the method by which you calculate your net promoter score and explain how management uses this score to monitor or manage your business. Disclose any underlying assumptions and limitations in how the score is calculated or used. The Company calculates Net Promoter Score ( NPS ) in a manner that it believes is consistent with how NPS is calculated by other companies.",0,0,0,0,0,1,0,0,,,,,,
